id,claim,source,date,label,explanation,reference_links
1,"Wearing masks reduces COVID-19 transmission","WHO","2020-06-15",true,"Masks filter respiratory droplets containing virus","https://www.who.int/emergencies/diseases/novel-coronavirus-2019/advice-for-public/when-and-how-to-use-masks"
2,"Vaccines prevent deadly diseases","CDC","2019-04-22",true,"Vaccination has eradicated smallpox and nearly eliminated polio","https://www.cdc.gov/vaccines/vac-gen/howvpd.htm"
3,"Regular exercise improves heart health","American Heart Association","2021-01-10",true,"Physical activity strengthens cardiovascular system","https://www.heart.org/en/healthy-living/fitness"
4,"Mammograms detect breast cancer early","American Cancer Society","2020-11-05",true,"Early detection improves treatment outcomes","https://www.cancer.org/cancer/breast-cancer/screening-tests-and-early-detection/mammograms.html"
5,"Handwashing prevents disease spread","CDC","2020-03-01",true,"Removes germs from hands effectively","https://www.cdc.gov/handwashing/when-how-handwashing.html"
6,"Smoking causes lung cancer","WHO","2019-07-18",true,"Tobacco contains carcinogens that damage lung tissue","https://www.who.int/news-room/fact-sheets/detail/tobacco"
7,"HPV vaccine prevents cervical cancer","CDC","2020-09-14",true,"Protects against cancer-causing HPV strains","https://www.cdc.gov/hpv/parents/vaccine/safety.html"
8,"Annual flu shots reduce hospitalization","CDC","2021-10-05",true,"Prevents severe flu complications","https://www.cdc.gov/flu/prevent/vaccine-benefits.htm"
9,"Diabetes can be managed with diet","American Diabetes Association","2020-05-22",true,"Healthy eating helps control blood sugar","https://www.diabetes.org/healthy-living/recipes-nutrition"
10,"CT scans detect internal injuries","Radiology Society","2019-12-03",true,"Provides detailed images of internal structures","https://www.radiologyinfo.org/en/info.cfm?pg=bodyct"
11,"Mosquito nets prevent malaria","WHO","2018-08-17",true,"Physical barrier against mosquito bites","https://www.who.int/malaria/areas/vector_control/insecticide_treated_nets/en/"
12,"Antioxidants protect cells from damage","NIH","2020-07-29",true,"Neutralize harmful free radicals","https://www.ncbi.nlm.nih.gov/pmc/articles/PMC3093095/"
13,"Regular sleep improves immunity","Sleep Foundation","2021-02-11",true,"Adequate sleep strengthens immune response","https://www.sleepfoundation.org/how-sleep-works/how-sleep-affects-immunity"
14,"Prenatal vitamins prevent birth defects","March of Dimes","2019-11-20",true,"Folic acid reduces neural tube defects","https://www.marchofdimes.org/pregnancy/prenatal-vitamins.aspx"
15,"Blood pressure medication saves lives","American Heart Association","2020-01-15",true,"Reduces risk of heart attack and stroke","https://www.heart.org/en/health-topics/high-blood-pressure/changes-you-can-make-to-manage-high-blood-pressure"
16,"Physical therapy aids recovery","APTA","2021-03-08",true,"Improves mobility after injury/surgery","https://www.apta.org/patient-care/"
17,"HIV treatment prevents transmission","CDC","2020-08-12",true,"Undetectable viral load means untransmittable","https://www.cdc.gov/hiv/basics/livingwithhiv/treatment.html"
18,"Colonoscopies prevent colon cancer","American Cancer Society","2019-09-25",true,"Detects and removes precancerous polyps","https://www.cancer.org/latest-news/american-cancer-society-updates-colon-cancer-screening-guideline.html"
19,"Insulin regulates blood sugar","NIH","2020-04-30",true,"Essential for diabetes management","https://www.niddk.nih.gov/health-information/diabetes/overview/what-is-diabetes"
20,"Vasectomies are effective birth control","Planned Parenthood","2021-07-19",true,"Permanent sterilization procedure","https://www.plannedparenthood.org/learn/birth-control/vasectomy"
21,"Chemotherapy kills cancer cells","National Cancer Institute","2019-06-12",true,"Destroys rapidly dividing cells","https://www.cancer.gov/about-cancer/treatment/types/chemotherapy"
22,"Allergy shots reduce symptoms","AAAAI","2020-10-28",true,"Desensitizes immune system to allergens","https://www.aaaai.org/conditions-and-treatments/library/allergy-library/allergy-shots-(immunotherapy)"
23,"Antidepressants help with depression","NIH","2021-05-14",true,"Correct chemical imbalances in brain","https://www.nimh.nih.gov/health/topics/depression/index.shtml"
24,"Prostate exams detect cancer early","American Cancer Society","2019-04-17",true,"Identifies abnormalities in prostate","https://www.cancer.org/cancer/prostate-cancer/detection-diagnosis-staging/tests.html"
25,"Physical exams detect health issues","AMA","2020-12-09",true,"Identifies problems before symptoms appear","https://www.ama-assn.org/delivering-care/preventive-care"
26,"Statins reduce cholesterol","American Heart Association","2021-02-03",true,"Lowers LDL ('bad') cholesterol","https://www.heart.org/en/health-topics/cholesterol/prevention-and-treatment-of-high-cholesterol-hyperlipidemia"
27,"Ventilators save lives in respiratory failure","WHO","2020-03-25",true,"Provides mechanical breathing support","https://www.who.int/news-room/questions-and-answers/item/coronavirus-disease-covid-19-ventilators"
28,"Pap smears detect cervical cancer","CDC","2019-10-31",true,"Identifies precancerous cells","https://www.cdc.gov/cancer/cervical/basic_info/screening.htm"
29,"Blood tests detect infections","Mayo Clinic","2021-01-28",true,"Identifies pathogens and antibodies","https://www.mayoclinic.org/tests-procedures/complete-blood-count/about/pac-20384919"
30,"Radiation therapy treats cancer","National Cancer Institute","2020-07-15",true,"Destroys cancer cells with targeted beams","https://www.cancer.gov/about-cancer/treatment/types/radiation-therapy"
31,"CPR saves lives during cardiac arrest","American Heart Association","2019-12-12",true,"Maintains blood flow to vital organs","https://cpr.heart.org/en/"
32,"Vaccines create herd immunity","WHO","2020-09-08",true,"Protects those who can't be vaccinated","https://www.who.int/news-room/questions-and-answers/item/herd-immunity-lockdowns-and-covid-19"
33,"Beta blockers lower blood pressure","NIH","2021-04-21",true,"Reduces heart rate and blood pressure","https://www.nhlbi.nih.gov/health/high-blood-pressure/treatment"
34,"Mammograms reduce breast cancer deaths","American Cancer Society","2019-08-07",true,"Early detection improves survival rates","https://www.cancer.org/cancer/breast-cancer/screening-tests-and-early-detection/mammograms.html"
35,"Insulin pumps improve diabetes control","American Diabetes Association","2020-11-19",true,"Provides continuous insulin delivery","https://www.diabetes.org/healthy-living/devices-technology/insulin-pumps"
36,"Antiviral medications treat flu","CDC","2021-10-12",true,"Reduces severity and duration","https://www.cdc.gov/flu/treatment/whatyoushould.htm"
37,"Physical activity prevents osteoporosis","NIH","2019-05-29",true,"Weight-bearing exercise strengthens bones","https://www.bones.nih.gov/health-info/bone/exercise/exercise-and-bone-health"
38,"Pneumonia vaccines prevent infection","CDC","2020-02-27",true,"Protects against bacterial pneumonia","https://www.cdc.gov/vaccines/vpd/pneumo/index.html"
39,"Blood thinners prevent clots","American Heart Association","2021-03-17",true,"Reduces risk of stroke and embolism","https://www.heart.org/en/health-topics/arrhythmia/prevention--treatment-of-arrhythmia/medications-for-arrhythmia"
40,"Organ transplants save lives","UNOS","2019-11-14",true,"Replaces failing organs with healthy ones","https://unos.org/transplant/"
41,"Stem cell therapy treats blood cancers","NIH","2020-08-05",true,"Rebuilds healthy blood cells","https://www.cancer.gov/about-cancer/treatment/types/stem-cell-transplant"
42,"Glaucoma screening prevents blindness","American Academy of Ophthalmology","2021-01-07",true,"Early detection prevents vision loss","https://www.aao.org/eye-health/diseases/glaucoma-diagnosis"
43,"HIV medication prevents AIDS","WHO","2019-09-18",true,"Suppresses viral replication","https://www.who.int/news-room/fact-sheets/detail/hiv-aids"
44,"Bariatric surgery aids weight loss","NIH","2020-12-16",true,"Reduces stomach capacity","https://www.niddk.nih.gov/health-information/weight-management/bariatric-surgery"
45,"EpiPens treat anaphylaxis","American Academy of Allergy, Asthma & Immunology","2021-02-25",true,"Epinephrine reverses severe allergic reactions","https://www.aaaai.org/conditions-and-treatments/library/allergy-library/epinephrine"
46,"Dialysis filters blood","National Kidney Foundation","2019-07-23",true,"Replaces kidney function","https://www.kidney.org/atoz/content/dialysisinfo"
47,"Antipsychotics treat schizophrenia","NIH","2020-10-07",true,"Manages symptoms of psychosis","https://www.nimh.nih.gov/health/topics/schizophrenia/index.shtml"
48,"Fluoride prevents tooth decay","American Dental Association","2021-05-06",true,"Strengthens tooth enamel","https://www.ada.org/resources/research/science-and-research-institute/oral-health-topics/fluoride-topical-and-systemic-supplements"
49,"Pacemakers regulate heartbeat","American Heart Association","2019-04-04",true,"Controls abnormal heart rhythms","https://www.heart.org/en/health-topics/arrhythmia/prevention--treatment-of-arrhythmia/pacemaker"
50,"Hearing aids improve hearing loss","NIH","2020-09-30",true,"Amplifies sound for better hearing","https://www.nidcd.nih.gov/health/hearing-aids"
51,"Physical therapy helps stroke recovery","American Stroke Association","2021-03-11",true,"Restores movement and function","https://www.stroke.org/en/life-after-stroke/stroke-rehab"
52,"Immunotherapy treats cancer","National Cancer Institute","2019-10-24",true,"Boosts immune system to fight cancer","https://www.cancer.gov/about-cancer/treatment/types/immunotherapy"
53,"Insulin injections manage diabetes","American Diabetes Association","2020-07-08",true,"Regulates blood sugar levels","https://www.diabetes.org/healthy-living/medication-treatments/insulin-other-injectables"
54,"Blood transfusions save lives","American Red Cross","2021-01-21",true,"Replaces lost blood volume","https://www.redcrossblood.org/donate-blood/how-to-donate/common-concerns/first-time-donors.html"
55,"Antibiotics treat bacterial infections","CDC","2019-12-05",true,"Kills or inhibits bacterial growth","https://www.cdc.gov/antibiotic-use/q-a.html"
56,"Radiation detects breast cancer","American Cancer Society","2020-08-19",true,"Mammograms use low-dose radiation","https://www.cancer.org/cancer/breast-cancer/screening-tests-and-early-detection/mammograms.html"
57,"Vaccines protect against hepatitis B","WHO","2021-04-14",true,"Prevents liver infection","https://www.who.int/news-room/questions-and-answers/item/hepatitis-b"
58,"CPAP treats sleep apnea","American Sleep Association","2019-11-07",true,"Provides continuous airway pressure","https://www.sleepassociation.org/sleep-treatments/cpap/"
59,"Chemotherapy extends life","National Cancer Institute","2020-06-24",true,"Increases survival rates","https://www.cancer.gov/about-cancer/treatment/types/chemotherapy"
60,"Antiretroviral therapy controls HIV","CDC","2021-02-18",true,"Suppresses viral load","https://www.cdc.gov/hiv/basics/livingwithhiv/treatment.html"
61,"Physical activity reduces depression","NIH","2019-08-29",true,"Releases endorphins that improve mood","https://www.ncbi.nlm.nih.gov/pmc/articles/PMC1470658/"
62,"Vaccines prevent measles","WHO","2020-05-07",true,"Highly effective at preventing infection","https://www.who.int/news-room/fact-sheets/detail/measles"
63,"Blood sugar monitoring manages diabetes","American Diabetes Association","2021-06-03",true,"Helps maintain proper glucose levels","https://www.diabetes.org/healthy-living/medication-treatments/blood-glucose-testing-and-control"
64,"Anticoagulants prevent strokes","American Heart Association","2019-07-12",true,"Reduces blood clot formation","https://www.heart.org/en/health-topics/atrial-fibrillation/treatment-and-prevention-of-atrial-fibrillation/anticoagulation-for-afib"
65,"Radiation treats thyroid cancer","American Thyroid Association","2020-04-16",true,"Targets thyroid tissue effectively","https://www.thyroid.org/radioactive-iodine/"
66,"Vaccines prevent whooping cough","CDC","2021-01-14",true,"DTaP vaccine is highly effective","https://www.cdc.gov/pertussis/vaccines.html"
67,"Physical therapy helps arthritis","Arthritis Foundation","2019-10-03",true,"Improves joint mobility","https://www.arthritis.org/health-wellness/treatment/treatment-plan/treatment-guide/physical-therapy"
68,"Antibiotics cure strep throat","Mayo Clinic","2020-09-23",true,"Eradicates streptococcal bacteria","https://www.mayoclinic.org/diseases-conditions/strep-throat/diagnosis-treatment/drc-20350344"
69,"Blood pressure monitoring prevents complications","American Heart Association","2021-03-25",true,"Early detection of hypertension","https://www.heart.org/en/health-topics/high-blood-pressure/understanding-blood-pressure-readings"
70,"Vaccines prevent tetanus","WHO","2019-09-12",true,"Tetanus toxoid provides immunity","https://www.who.int/news-room/fact-sheets/detail/tetanus"
71,"Insulin pumps improve diabetes management","American Diabetes Association","2020-08-14",true,"Provides precise insulin dosing","https://www.diabetes.org/healthy-living/devices-technology/insulin-pumps"
72,"Antidepressants treat anxiety disorders","NIH","2021-02-09",true,"Regulates brain chemistry","https://www.nimh.nih.gov/health/topics/anxiety-disorders/index.shtml"
73,"Physical activity prevents obesity","CDC","2019-06-20",true,"Burns calories and builds muscle","https://www.cdc.gov/healthyweight/physical_activity/index.html"
74,"Vaccines prevent rubella","WHO","2020-07-30",true,"MMR vaccine provides immunity","https://www.who.int/news-room/fact-sheets/detail/rubella"
75,"Blood tests detect diabetes","American Diabetes Association","2021-04-08",true,"Measures glucose levels","https://www.diabetes.org/a1c/diagnosis"
76,"Antibiotics treat pneumonia","American Lung Association","2019-05-16",true,"Effective against bacterial pneumonia","https://www.lung.org/lung-health-diseases/lung-disease-lookup/pneumonia/treatment-and-recovery"
77,"Radiation treats prostate cancer","American Cancer Society","2020-03-12",true,"Targets prostate tissue","https://www.cancer.org/cancer/prostate-cancer/treating/radiation-therapy.html"
78,"Vaccines prevent diphtheria","CDC","2021-05-20",true,"DTaP vaccine provides immunity","https://www.cdc.gov/vaccines/vpd/diphtheria/index.html"
79,"Physical therapy aids recovery from surgery","APTA","2019-04-25",true,"Restores mobility and function","https://www.apta.org/patient-care/"
80,"Antihistamines treat allergies","American Academy of Allergy, Asthma & Immunology","2020-11-05",true,"Blocks histamine effects","https://www.aaaai.org/conditions-and-treatments/library/allergy-library/antihistamines"
81,"Blood donation saves lives","American Red Cross","2021-06-17",true,"Provides life-saving transfusions","https://www.redcrossblood.org/donate-blood/how-to-donate/common-concerns/first-time-donors.html"
82,"Vaccines prevent mumps","WHO","2019-08-14",true,"MMR vaccine provides immunity","https://www.who.int/news-room/fact-sheets/detail/mumps"
83,"Physical activity reduces cancer risk","American Cancer Society","2020-01-29",true,"Lowers inflammation and hormone levels","https://www.cancer.org/latest-news/can-exercise-lower-cancer-risk.html"
84,"Antibiotics treat urinary tract infections","NIH","2021-03-04",true,"Effective against E. coli bacteria","https://www.niddk.nih.gov/health-information/urologic-diseases/bladder-infection-uti-in-adults/treatment"
85,"Radiation treats lymphoma","American Cancer Society","2019-07-05",true,"Targets cancerous lymphocytes","https://www.cancer.org/cancer/non-hodgkin-lymphoma/treating/radiation-therapy.html"
86,"Vaccines prevent polio","WHO","2020-10-21",true,"IPV vaccine provides immunity","https://www.who.int/news-room/fact-sheets/detail/polio"
87,"Physical therapy helps back pain","APTA","2021-02-12",true,"Strengthens core muscles","https://www.apta.org/patient-care/"
88,"Antifungals treat yeast infections","Mayo Clinic","2019-09-27",true,"Effective against Candida","https://www.mayoclinic.org/diseases-conditions/yeast-infection/diagnosis-treatment/drc-20379004"
89,"Blood tests detect anemia","NIH","2020-05-28",true,"Measures hemoglobin levels","https://www.nhlbi.nih.gov/health-topics/iron-deficiency-anemia"
90,"Vaccines prevent hepatitis A","CDC","2021-04-01",true,"Provides long-term immunity","https://www.cdc.gov/vaccines/vpd/hepa/index.html"
91,"Physical activity improves sleep","Sleep Foundation","2019-12-19",true,"Promotes deeper sleep cycles","https://www.sleepfoundation.org/physical-activity-and-sleep"
92,"Antibiotics treat Lyme disease","CDC","2020-09-16",true,"Effective against Borrelia bacteria","https://www.cdc.gov/lyme/treatment/index.html"
93,"Radiation treats skin cancer","Skin Cancer Foundation","2021-01-07",true,"Targets basal and squamous cells","https://www.skincancer.org/treatment-resources/radiation-therapy/"
94,"Vaccines prevent chickenpox","WHO","2019-11-21",true,"Varicella vaccine provides immunity","https://www.who.int/news-room/fact-sheets/detail/varicella-(chickenpox)"
95,"Physical therapy helps Parkinson's disease","Parkinson's Foundation","2020-08-27",true,"Improves mobility and balance","https://www.parkinson.org/living-with-parkinsons/treatment/physical-therapy"
96,"Antivirals treat shingles","CDC","2021-03-18",true,"Reduces severity and duration","https://www.cdc.gov/shingles/about/treatment.html"
97,"Blood tests detect kidney disease","National Kidney Foundation","2019-10-10",true,"Measures creatinine levels","https://www.kidney.org/atoz/content/kidneytests"
98,"Vaccines prevent Hib disease","CDC","2020-07-02",true,"Prevents Haemophilus influenzae type b","https://www.cdc.gov/vaccines/vpd/hib/index.html"
99,"Physical activity strengthens bones","NIH","2021-05-13",true,"Weight-bearing exercise builds density","https://www.bones.nih.gov/health-info/bone/exercise/exercise-and-bone-health"
100,"Antibiotics are ineffective against viruses","Mayo Clinic","2019-08-12",true,"Antibiotics only work on bacterial infections","https://www.mayoclinic.org/healthy-lifestyle/consumer-health/in-depth/antibiotics/art-20045720"
101,"COVID-19 vaccines implant tracking microchips","Social media","2021-03-18",false,"Vaccines contain no electronic components","https://www.reuters.com/article/factcheck-vaccine-microchip/fact-check-covid-19-vaccines-do-not-contain-microchips-idUSL1N2LE1DX"
102,"Drinking bleach cures COVID-19","Online forum","2020-04-02",false,"Bleach is poisonous and damages internal organs","https://www.poison.org/articles/bleach"
103,"5G networks spread coronavirus","Conspiracy site","2020-02-28",false,"Viruses cannot travel via radio waves","https://www.who.int/emergencies/diseases/novel-coronavirus-2019/advice-for-public/myth-busters"
104,"Vaccines cause autism","Anti-vaccine website","2019-05-15",false,"No scientific link between vaccines and autism","https://www.cdc.gov/vaccinesafety/concerns/autism.html"
105,"Garlic prevents COVID-19 infection","Social media","2020-03-10",false,"No evidence garlic protects against viruses","https://www.who.int/emergencies/diseases/novel-coronavirus-2019/advice-for-public/myth-busters"
106,"Cancer is a fungus cured by baking soda","Alternative health blog","2021-05-15",false,"Cancer involves abnormal cell growth, not fungi","https://www.cancer.gov/about-cancer/treatment/cam/hp/prostate-cancer-pdq"
107,"HIV can spread through mosquito bites","Misinformation site","2019-07-22",false,"HIV cannot survive in mosquitoes","https://www.hiv.gov/hiv-basics/overview/about-hiv-and-aids/how-is-hiv-transmitted"
108,"Chemotherapy kills more patients than cancer","Social media","2021-01-05",false,"Chemotherapy saves lives when properly administered","https://www.cancer.gov/about-cancer/treatment/types/chemotherapy"
109,"Vaccines contain aborted fetal tissue","Conspiracy website","2020-08-15",false,"No vaccines contain fetal tissue","https://www.chop.edu/centers-programs/vaccine-education-center/vaccine-ingredients/fetal-tissues"
110,"COVID-19 was created in a lab","Conspiracy theory","2020-03-28",false,"Scientific consensus shows natural origin","https://www.nature.com/articles/s41591-020-0820-9"
111,"Ivermectin is a miracle cure for COVID-19","Social media","2021-07-30",false,"No conclusive evidence supports this claim","https://www.fda.gov/consumers/consumer-updates/why-you-should-not-use-ivermectin-treat-or-prevent-covid-19"
112,"The MMR vaccine causes SIDS","Anti-vaccine website","2019-04-01",false,"No link between MMR and SIDS","https://www.cdc.gov/vaccinesafety/concerns/sids.html"
113,"You can detox your body with juice cleanses","Wellness blog","2021-05-22",false,"The body has its own detoxification systems","https://www.health.harvard.edu/staying-healthy/the-dubious-practice-of-detox"
114,"GMOs cause irreversible genetic damage","Anti-GMO organization","2020-07-19",false,"GMOs are safe according to major health organizations","https://www.who.int/foodsafety/areas_work/food-technology/faq-genetically-modified-food/en/"
115,"Vaccine side effects are worse than the diseases","Misinformation site","2020-12-08",false,"Vaccine benefits far outweigh risks","https://www.who.int/vaccine_safety/initiative/detection/immunization_misconceptions/en/"
116,"Antioxidants prevent all cancers","Health magazine","2018-11-30",false,"While beneficial, they don't prevent all cancers","https://www.cancer.gov/about-cancer/causes-prevention/risk/diet/antioxidants-fact-sheet"
117,"COVID-19 is no worse than the flu","Misinformation","2020-09-14",false,"COVID-19 has higher mortality and complication rates","https://www.cdc.gov/flu/symptoms/flu-vs-covid19.htm"
118,"Vitamin C injections cure cancer","Alternative health blog","2021-02-14",false,"No scientific evidence supports this claim","https://www.cancer.gov/about-cancer/treatment/cam/hp/vitamin-c-pdq"
119,"Homeopathy is as effective as medicine","Alternative medicine site","2019-10-12",false,"No scientific basis for homeopathic treatments","https://www.nccih.nih.gov/health/homeopathy"
120,"The flu vaccine gives you the flu","Social media post","2019-10-12",false,"Flu vaccines cannot cause flu illness","https://www.cdc.gov/flu/prevent/misconceptions.htm"
121,"Cancer loves sugar","Misinformation","2020-06-18",false,"Sugar doesn't make cancer grow faster","https://www.cancer.gov/about-cancer/causes-prevention/risk/diet/artificial-sweeteners-fact-sheet"
122,"You can sweat out toxins","Wellness myth","2021-04-09",false,"Toxins are removed by liver and kidneys","https://www.health.harvard.edu/staying-healthy/the-truth-about-toxins"
123,"Vaccines cause sudden infant death syndrome","Anti-vaccine site","2020-05-05",false,"No evidence linking vaccines to SIDS","https://www.cdc.gov/vaccinesafety/concerns/sids.html"
124,"Essential oils can replace antibiotics","Alternative health","2019-12-20",false,"No evidence oils can treat bacterial infections","https://www.nccih.nih.gov/health/essential-oils"
125,"Wearing a mask causes oxygen deprivation","Social media","2020-07-08",false,"Masks don't significantly reduce oxygen intake","https://www.hopkinsmedicine.org/health/conditions-and-diseases/coronavirus/coronavirus-face-masks-what-you-need-to-know"
126,"Alkaline water cures cancer","Alternative health","2021-03-05",false,"Body regulates pH independently of water intake","https://www.cancer.gov/about-cancer/treatment/cam/hp/prostate-cancer-pdq"
127,"COVID-19 tests cause brain damage","Conspiracy theory","2020-11-19",false,"Nasal swabs don't reach the brain","https://www.fda.gov/medical-devices/coronavirus-covid-19-and-medical-devices/faqs-testing-sars-cov-2"
128,"Vaccines cause infertility","Misinformation","2021-01-25",false,"No evidence vaccines affect fertility","https://www.cdc.gov/coronavirus/2019-ncov/vaccines/planning-for-pregnancy.html"
129,"Colloidal silver treats COVID-19","Alternative medicine","2020-09-03",false,"No evidence of effectiveness, can cause harm","https://www.fda.gov/consumers/consumer-updates/colloidal-silver-not-safe-or-effective"
130,"Chemotherapy doesn't work","Misinformation","2019-08-28",false,"Chemotherapy has saved millions of lives","https://www.cancer.gov/about-cancer/treatment/types/chemotherapy"
131,"The human body has unused DNA that vaccines activate","Pseudoscience","2020-12-14",false,"No such 'unused DNA' exists","https://www.genome.gov/about-genomics/fact-sheets/Deoxyribonucleic-Acid-Fact-Sheet"
132,"Microwaving food causes cancer","Myth","2021-02-22",false,"Microwaves don't make food radioactive","https://www.cancer.org/cancer/cancer-causes/radiation-exposure/radiofrequency-radiation.html"
133,"Vaccines contain mercury that causes brain damage","Misinformation","2019-11-15",false,"Thimerosal was removed from childhood vaccines","https://www.cdc.gov/vaccinesafety/concerns/thimerosal/index.html"
134,"COVID-19 vaccines alter your DNA","Social media","2021-04-30",false,"mRNA vaccines don't interact with DNA","https://www.cdc.gov/coronavirus/2019-ncov/vaccines/facts.html"
135,"The government puts tracking chips in vaccines","Conspiracy theory","2020-10-07",false,"Vaccines contain no tracking devices","https://www.reuters.com/article/factcheck-vaccine-microchip/fact-check-covid-19-vaccines-do-not-contain-microchips-idUSL1N2LE1DX"
136,"You only use 10% of your brain","Myth","2019-09-09",false,"Brain imaging shows full brain utilization","https://www.scientificamerican.com/article/do-people-only-use-10-percent-of-their-brains/"
137,"Vaccines cause Guillain-Barré syndrome","Misinformation","2020-08-26",false,"Extremely rare, benefits outweigh risks","https://www.cdc.gov/vaccinesafety/concerns/guillain-barre-syndrome.html"
